Release Date,Title,Rating,Budget,Revenue,Genres,Keywords,Director,Cast,Production Companies
1988-12-12,Rain Man,7.76,25000000,354825435,Drama,"mentally disabled, individual, loss of loved one, yuppie, autism, car dealer, egocentrism, convertible, road trip, blackjack, cincinnati, travel, las vegas, psychiatrist, disability, duringcreditsstinger, asperger's syndrome, savant",Barry Levinson,"Dustin Hoffman, Tom Cruise, Valeria Golino, Gerald R. Molen, Jack Murdock","United Artists, Star Partners II Ltd., The Guber-Peters Company"
1988-06-21,Who Framed Roger Rabbit,7.519,70000000,329800000,"Fantasy, Animation, Comedy, Crime","based on novel or book, falsely accused, movie business, innocence, suspicion of murder, cartoon, mental breakdown, whodunit, los angeles, california, love sickness, private detective, movie star, cartoon rabbit, neo-noir, 1940s, live action and animation",Robert Zemeckis,"Bob Hoskins, Christopher Lloyd, Joanna Cassidy, Charles Fleischer, Stubby Kaye","Amblin Entertainment, Silver Screen Partners III, Touchstone Pictures"
1988-06-29,Coming to America,6.868,30000000,288752301,"Comedy, Romance","new york city, fast food restaurant, prince, fake identity, heir to the throne, fish out of water, duringcreditsstinger, searching for love",John Landis,"Eddie Murphy, Arsenio Hall, James Earl Jones, John Amos, Shari Headley","Eddie Murphy Productions, Paramount"
1988-05-19,Crocodile Dundee II,5.816,14000000,239606210,"Adventure, Comedy","australia, new york city, crocodile, knife, adventurer, aftercreditsstinger, kangaroo",John Cornell,"Paul Hogan, Linda Kozlowski, John Meillon, Ernie Dingo, Charles S. Dutton",Paramount
1988-12-08,Twins,6.0,15000000,216614388,Comedy,"experiment, orphanage, perfection, low intelligence, jet engine, twins separated at birth, artist colony, same habits, opposites",Ivan Reitman,"Arnold Schwarzenegger, Danny DeVito, Kelly Preston, Chloe Webb, Bonnie Bartlett",Universal Pictures
1988-05-24,Rambo III,6.178,63000000,189015611,"Action, Adventure, Thriller, War","submachine gun, competition, machinegun, liberation, soviet union, soviet military, thailand, freedom fighter, afghanistan, war on freedom, mujahid",Peter MacDonald,"Sylvester Stallone, Richard Crenna, Marc de Jonge, Kurtwood Smith, Spiros Focás","TriStar Pictures, Carolco Pictures"
1988-07-29,Cocktail,6.099,20000000,171504781,"Romance, Drama, Comedy","new york city, jamaica, night life, bartender, ambition, rags to riches, cocktail",Roger Donaldson,"Tom Cruise, Bryan Brown, Elisabeth Shue, Lisa Banes, Kelly Lynch","Interscope Communications, Touchstone Pictures, Silver Screen Partners III"
1988-06-03,Big,7.164,18000000,151927281,"Fantasy, Drama, Comedy, Romance, Family","baseball, romance, coming of age, best friend, co-workers relationship, body-swap, magic realism, bronx, new york city, pinball machine, toy maker, job promotion, homesick, new toy, quarter, unplugged electronic works, yankee stadium, wish fulfillment, bunk bed, woman director, age change",Penny Marshall,"Tom Hanks, Elizabeth Perkins, Robert Loggia, John Heard, Jared Rushton","American Entertainment Partners II L.P., Gracie Films, 20th Century Fox"
1988-07-15,Die Hard,7.78,28000000,140767956,"Action, Thriller","based on novel or book, s.w.a.t., hostage, fbi, christmas party, vault, heist, murder, shootout, los angeles, california, terrorism, one man army, hostage negotiator, one night, 1980s, action hero, german",John McTiernan,"Bruce Willis, Alan Rickman, Alexander Godunov, Bonnie Bedelia, Reginald VelJohnson","Gordon Company, Silver Pictures, 20th Century Fox"
1988-10-21,The Bear,6.992,25000000,138241022,"Adventure, Drama, Family","canada, based on novel or book, rocky mountains, wilderness, kodiak bear, brown bear, puma, fur trapping, spring, summer, dog, bear cub",Jean-Jacques Annaud,"Tchéky Karyo, Jack Wallace, André Lacombe, Bart The Bear, Youk the Bear","Renn Productions, Price, Pathé"
1988-12-02,Tequila Sunrise,6.058,23000000,105900000,"Thriller, Crime, Romance","drug dealer, restaurant owner, woman between two men, cop, organized crime, best friend, los angeles, california, drug lord, seaside town, best friends, best friends on opposite sides",Robert Towne,"Mel Gibson, Michelle Pfeiffer, Kurt Russell, Raúl Juliá, J.T. Walsh","Cinema City Films, The Mount Company, Warner Bros. Pictures"
1988-12-20,Working Girl,6.598,28000000,103173635,"Comedy, Romance, Drama","new york city, strong woman, love triangle, clerk, empowerment, feminism, career woman, business, female protagonist, staten island, new york city, working woman, female empowerment, determination, ferry",Mike Nichols,"Melanie Griffith, Harrison Ford, Sigourney Weaver, Alec Baldwin, Joan Cusack",20th Century Fox
1988-11-18,The Land Before Time,7.117,12500000,84460846,"Family, Animation, Adventure","vulkan, loss of loved one, tyrannosaurus rex, earthquake, primitive time, dinosaur",Don Bluth,"Gabriel Damon, Candace Hutson, Will Ryan, Judith Barsi, Helen Shaver","Sullivan Bluth Studios, U-Drive Productions, Amblin Entertainment, Lucasfilm Ltd., Universal Pictures"
1988-12-02,The Naked Gun: From the Files of Police Squad!,7.242,12000000,78756177,"Comedy, Crime","police, aquarium, baseball, parody, slapstick comedy, los angeles, california, terrorism, illegal drugs, criminal investigation, buddy cop, anarchic comedy, good versus evil, based on tv series",David Zucker,"Leslie Nielsen, Priscilla Presley, Ricardo Montalban, George Kennedy, O.J. Simpson",Paramount
1988-03-30,Beetlejuice,7.378,15000000,74800000,"Fantasy, Comedy","skeleton, afterlife, calypso, supernatural, arts, halloween, minister, possession, giant snake, surrealism, child bride, teenage girl, gothic, madness, ghost, property",Tim Burton,"Alec Baldwin, Geena Davis, Jeffrey Jones, Catherine O'Hara, Winona Ryder",Geffen Pictures
1988-11-18,Oliver & Company,6.719,31000000,74151346,"Animation, Comedy, Family","new york city, based on novel or book, dog, kitten, great dane",George Scribner,"Joey Lawrence, Billy Joel, Cheech Marin, Richard Mulligan, Roscoe Lee Browne","Walt Disney Pictures, Silver Screen Partners III, Walt Disney Feature Animation"
1988-10-29,Moonwalker,6.893,22000000,67000000,"Fantasy, Music","dancing, drug crime, gangster, entertainer, parody, stop motion, live performance, robot, claymation","Will Vinton, Colin Chilvers, Jerry Kramer","Michael Jackson, Joe Pesci, Sean Lennon, Kelley Parker, Brandon Quintin Adams","Ultimate Productions, Will Vinton Productions, The Michael Jackson Company, Lorimar Motion Pictures, Warner Bros. Pictures"
1988-02-26,Bloodsport,7.019,1500000,65000000,"Action, Thriller","martial arts, sports, biography, fistfight, sensei, mixed martial arts, hong kong, tournament, underground fighting, walled city, kowloon, action hero",Newt Arnold,"Jean-Claude Van Damme, Bolo Yeung, Donald Gibb, Leah Ayres, Norman Burton",Cannon Group
1988-07-15,A Fish Called Wanda,7.196,7500000,62493712,"Comedy, Crime","infidelity, robbery, cheating, heart attack, heist, lawyer, silencer, courtroom, american abroad, animal abuse, stuttering, yelling, killing a dog, cutical scissors, run over by a steamroller, gag, excuse, barrel, zoophilia, screwball, heathrow airport, stolen jewelry",Charles Crichton,"Jamie Lee Curtis, John Cleese, Kevin Kline, Michael Palin, Maria Aitken","Prominent Features, Metro-Goldwyn-Mayer, Fish Productions"
1988-11-22,Scrooged,6.798,32000000,60300000,"Fantasy, Comedy, Drama","holiday, tv ratings, ghost, duringcreditsstinger, christmas music, christmas",Richard Donner,"Bill Murray, Karen Allen, John Forsythe, John Glover, Bobcat Goldthwait","Paramount, Mirage Productions"
